{
  "key": "heavy-turbolaser-battery",
  "name": "Heavy turbolaser battery",
  "sourceKey": "sotg",
  "contentSet": "core",
  "category": "weapon",
  "costInCredits": 4150,
  "weapon": {
    "mounting": "secondary",
    "weaponSize": "huge"
  },
  "properties": [
    "power",
    "constitution 15",
    "heavy",
    "overheat 2"
  ],
  "damage": {
    "numberOfDice": 3,
    "dieFaces": 12,
    "type": "energy"
  },
  "range": {
    "normal": 1200,
    "long": 4800
  }
}
