{
  "key": "thermite-cannon",
  "name": "Thermite cannon",
  "sourceKey": "sotg",
  "contentSet": "core",
  "category": "weapon",
  "costInCredits": 6300,
  "weapon": {
    "mounting": "primary",
    "weaponSize": "small"
  },
  "properties": [
    "power",
    "constitution 17",
    "melt",
    "overheat 2"
  ],
  "damage": {
    "numberOfDice": 1,
    "dieFaces": 12,
    "type": "fire"
  },
  "range": {
    "normal": 1200,
    "long": 4800
  }
}
